{
  "assistant_id": "meal-assistant-v1",
  "input": {
    "task_id": "11111111-1111-4111-8111-111111111111",
    "attempt_id": "22222222-2222-4222-8222-222222222222",
    "trace_id": "trace-for-test"
  },
  "metadata": {
    "task_id": "11111111-1111-4111-8111-111111111111",
    "attempt_id": "22222222-2222-4222-8222-222222222222",
    "release_id": "33333333-3333-4333-8333-333333333333",
    "artifact_sha256": "aaaaaaaaaaaaaaaaaaaaaaaaaaaaaaaaaaaaaaaaaaaaaaaaaaaaaaaaaaaaaaaa"
  },
  "on_completion": "keep"
}
